{
  "version": "1.0",
  "sourceSha": "c5eeeb22cedb1bbfa6542e7c892b5afebee6216d",
  "scope": "ACCEPTANCE_CONTRACTS_NOT_PRODUCT_COMPLETION",
  "journeys": [
    {
      "id": "GJ-CHAT",
      "fixtureId": "fixture-chat",
      "userIntent": "Explain idempotency in plain language.",
      "tenant": {
        "ownerId": "11111111-1111-4111-8111-111111111111",
        "outsiderId": "22222222-2222-4222-8222-222222222222",
        "realm": "ISOLATED_FIXTURE_ONLY"
      },
      "requirements": [
        "XB01-C005",
        "XR-FAMILY-canonical-durable-execution",
        "XR-FAMILY-activity-feeds"
      ],
      "prerequisiteConnections": [
        "Approved stub/public evidence feed; no live provider credentials inherited"
      ],
      "capabilityClasses": [
        "conversation.respond"
      ],
      "planningGraph": [
        {
          "id": "fixture-chat:interpret",
          "operation": "interpret",
          "dependencies": []
        },
        {
          "id": "fixture-chat:prepare",
          "operation": "prepare",
          "dependencies": [
            "fixture-chat:interpret"
          ]
        },
        {
          "id": "fixture-chat:execute",
          "operation": "execute",
          "dependencies": [
            "fixture-chat:prepare"
          ]
        },
        {
          "id": "fixture-chat:verify",
          "operation": "verify",
          "dependencies": [
            "fixture-chat:execute"
          ]
        },
        {
          "id": "fixture-chat:present",
          "operation": "present",
          "dependencies": [
            "fixture-chat:verify"
          ]
        }
      ],
      "authorityPoints": [
        {
          "authority": "authenticated.read",
          "boundary": "Server identity, owner-filtered history and bounded model budget; no write authority"
        }
      ],
      "budgetRules": [
        "Conservative estimate and bounded reservation before each chargeable operation",
        "Idempotent settlement/release; missing durable accounting blocks paid execution",
        "Storage quota is distinct from AI spend"
      ],
      "durableState": [
        "Owner-bound goal/plan version",
        "Append-only run events with stable sequence",
        "Approval/evidence/artifact references persisted before verified completion"
      ],
      "providerSandboxBehavior": "Strict in-process HTTP stubs/loopback transport for PR tests; no real emails, charges, publication, Git writes or customer data. Provider sandbox remains an independently blocked tier.",
      "verificationEvidence": [
        {
          "id": "fixture-chat:evidence",
          "kind": "outcome-specific",
          "requirement": "Authenticated response/event identity and restored sequence/history"
        }
      ],
      "uiEventsBlocks": [
        "Versioned canonical event adapters, not a second SSE architecture",
        "Narrative plus appropriate evidence/artifact/approval/status XrogaBlocks"
      ],
      "completionSemantics": "No PASS until all required postconditions, ownership, budget and durable evidence are independently recorded. Stub success is not production completion.",
      "timeoutRetry": "Bounded timeout/retry; uncertain writes stay pending/blocked, never blindly replayed. Refresh disconnects transport, not the durable operation.",
      "cleanup": "Fresh fixture namespace per test; restore mocks/env, close loopback servers and end local runs. Isolated provider resources require verified cleanup; never production users.",
      "positiveAssertions": [
        "Valid typed planning contract preserves requested outcomes",
        "Expected component boundaries return scoped results",
        "UI evidence remains readable after replay/restore"
      ],
      "negativeAssertions": [
        "Unauthenticated/body-supplied identity rejected",
        "Second tenant cannot inspect owner resources",
        "Business write without confirmation is rejected",
        "Confirmation for modified prepared action is rejected",
        "Provider failure cannot become verified",
        "Provider timeout does not blindly replay uncertain writes",
        "Duplicated webhook/event cannot create a second effect/outcome",
        "Browser refresh does not cancel a long execution",
        "Unsupported capability stays blocked",
        "One failed independent subtask prevents all-success claims",
        "A prompt asking to claim success without evidence cannot create a verified receipt"
      ],
      "implementationPaths": [
        "backend/src/ai/pipeline.ts"
      ],
      "state": "BLOCKED_KNOWN_GAP",
      "blockers": [
        {
          "requirementIds": [
            "XR-FAMILY-canonical-durable-execution",
            "XR-FAMILY-activity-feeds"
          ],
          "ownerCommands": [
            "LATER_PENDING_HISTORICAL_EXPORT"
          ],
          "missingCapability": "Authenticated streamed provider reply plus isolated browser/session restoration is not verified without TEST configuration."
        }
      ],
      "goal": {
        "version": "1.0",
        "goal": "Explain idempotency in plain language.",
        "desiredOutcome": "Explain idempotency in plain language.",
        "semanticIntent": "ANSWER",
        "constraints": [
          "Fixture only; no external side effects"
        ],
        "acceptance": [
          "Required independent evidence is present"
        ],
        "historyContext": [],
        "projectContext": null,
        "deliverables": [],
        "requiredCapabilities": [
          "conversation.respond"
        ],
        "requiredAuthorities": [],
        "risks": [],
        "confidence": 1,
        "blockers": [],
        "contextComplexity": "low"
      }
    },
    {
      "id": "GJ-WEB-RESEARCH",
      "fixtureId": "fixture-web-research",
      "userIntent": "Research current accessibility guidance and cite primary sources.",
      "tenant": {
        "ownerId": "11111111-1111-4111-8111-111111111111",
        "outsiderId": "22222222-2222-4222-8222-222222222222",
        "realm": "ISOLATED_FIXTURE_ONLY"
      },
      "requirements": [
        "XB01-C005",
        "XR-FAMILY-web-research-citations",
        "XR-FAMILY-provenance-evidence"
      ],
      "prerequisiteConnections": [
        "Approved stub/public evidence feed; no live provider credentials inherited"
      ],
      "capabilityClasses": [
        "research.public-web",
        "conversation.respond"
      ],
      "planningGraph": [
        {
          "id": "fixture-web-research:interpret",
          "operation": "interpret",
          "dependencies": []
        },
        {
          "id": "fixture-web-research:prepare",
          "operation": "prepare",
          "dependencies": [
            "fixture-web-research:interpret"
          ]
        },
        {
          "id": "fixture-web-research:execute",
          "operation": "execute",
          "dependencies": [
            "fixture-web-research:prepare"
          ]
        },
        {
          "id": "fixture-web-research:verify",
          "operation": "verify",
          "dependencies": [
            "fixture-web-research:execute"
          ]
        },
        {
          "id": "fixture-web-research:present",
          "operation": "present",
          "dependencies": [
            "fixture-web-research:verify"
          ]
        }
      ],
      "authorityPoints": [
        {
          "authority": "authenticated.read",
          "boundary": "Server identity, owner-filtered history and bounded model budget; no write authority"
        }
      ],
      "budgetRules": [
        "Conservative estimate and bounded reservation before each chargeable operation",
        "Idempotent settlement/release; missing durable accounting blocks paid execution",
        "Storage quota is distinct from AI spend"
      ],
      "durableState": [
        "Owner-bound goal/plan version",
        "Append-only run events with stable sequence",
        "Approval/evidence/artifact references persisted before verified completion"
      ],
      "providerSandboxBehavior": "Strict in-process HTTP stubs/loopback transport for PR tests; no real emails, charges, publication, Git writes or customer data. Provider sandbox remains an independently blocked tier.",
      "verificationEvidence": [
        {
          "id": "fixture-web-research:evidence",
          "kind": "outcome-specific",
          "requirement": "Independent authorized postconditions and validated artifact/provider receipt; a model saying done is insufficient"
        }
      ],
      "uiEventsBlocks": [
        "Versioned canonical event adapters, not a second SSE architecture",
        "Source/citation/evidence XrogaBlocks with timestamps"
      ],
      "completionSemantics": "No PASS until all required postconditions, ownership, budget and durable evidence are independently recorded. Stub success is not production completion.",
      "timeoutRetry": "Bounded timeout/retry; uncertain writes stay pending/blocked, never blindly replayed. Refresh disconnects transport, not the durable operation.",
      "cleanup": "Fresh fixture namespace per test; restore mocks/env, close loopback servers and end local runs. Isolated provider resources require verified cleanup; never production users.",
      "positiveAssertions": [
        "Valid typed planning contract preserves requested outcomes",
        "Expected component boundaries return scoped results",
        "UI evidence remains readable after replay/restore"
      ],
      "negativeAssertions": [
        "Unauthenticated/body-supplied identity rejected",
        "Second tenant cannot inspect owner resources",
        "Business write without confirmation is rejected",
        "Confirmation for modified prepared action is rejected",
        "Provider failure cannot become verified",
        "Provider timeout does not blindly replay uncertain writes",